{
  "case_id": "municipal-heat-001",
  "case_version": "0.1",
  "model_id": "synthetic-heat-model-v1",
  "lineage": {
    "artifacts": [
      {
        "artifact_id": "sha256:6f79e3acbca5d5a0fd2885738d43f7139b2fe29daf51a90cc64ebe8440dc3fe6",
        "kind": "MODEL",
        "manifest": {
          "model_id": "synthetic-heat-model-v1",
          "version": "1.0.0",
          "provenance": "Synthetic reference fixture; no empirical validation"
        },
        "parent_ids": [],
        "recall": null
      },
      {
        "artifact_id": "sha256:9d3843a84b994a048a1de2d818aa53ca8ef94581233f216d66e1545f863e9433",
        "kind": "ADAPTER",
        "manifest": {
          "adapter_id": "municipal-heat-fixture-adapter",
          "version": "1.0.0",
          "contract": "Translate the synthetic municipal heat fixture into the domain-independent outcome schema"
        },
        "parent_ids": [
          "sha256:6f79e3acbca5d5a0fd2885738d43f7139b2fe29daf51a90cc64ebe8440dc3fe6"
        ],
        "recall": null
      }
    ],
    "model_artifact_id": "sha256:6f79e3acbca5d5a0fd2885738d43f7139b2fe29daf51a90cc64ebe8440dc3fe6",
    "adapter_artifact_ids": [
      "sha256:9d3843a84b994a048a1de2d818aa53ca8ef94581233f216d66e1545f863e9433"
    ],
    "required_artifact_ids": [
      "sha256:6f79e3acbca5d5a0fd2885738d43f7139b2fe29daf51a90cc64ebe8440dc3fe6",
      "sha256:9d3843a84b994a048a1de2d818aa53ca8ef94581233f216d66e1545f863e9433"
    ]
  },
  "assessments": [
    { "candidate_id": "central_cooling_centers", "scenario_id": "ordinary_heatwave", "invariant_id": "high_risk_health_index", "stakeholder_id": "high_risk_residents", "scale": "municipal", "time_point": "event_peak", "observed_value": 0.6, "confidence": 0.82, "evidence_refs": ["heat_model"] },
    { "candidate_id": "central_cooling_centers", "scenario_id": "ordinary_heatwave", "invariant_id": "cooling_access_fraction", "stakeholder_id": "residents", "scale": "municipal", "time_point": "event_peak", "observed_value": 0.95, "confidence": 0.78, "evidence_refs": ["service_model"] },
    { "candidate_id": "central_cooling_centers", "scenario_id": "grid_outage_heatwave", "invariant_id": "high_risk_health_index", "stakeholder_id": "high_risk_residents", "scale": "municipal", "time_point": "hour_48", "observed_value": 0.9, "confidence": 0.78, "evidence_refs": ["heat_model"] },
    { "candidate_id": "central_cooling_centers", "scenario_id": "grid_outage_heatwave", "invariant_id": "cooling_access_fraction", "stakeholder_id": "residents", "scale": "municipal", "time_point": "hour_48", "observed_value": 0.82, "confidence": 0.74, "evidence_refs": ["service_model"] },
    { "candidate_id": "central_cooling_centers", "scenario_id": "smoke_heat_compound", "invariant_id": "high_risk_health_index", "stakeholder_id": "high_risk_residents", "scale": "municipal", "time_point": "event_peak", "observed_value": 0.95, "confidence": 0.75, "evidence_refs": ["heat_model"] },
    { "candidate_id": "central_cooling_centers", "scenario_id": "smoke_heat_compound", "invariant_id": "cooling_access_fraction", "stakeholder_id": "residents", "scale": "municipal", "time_point": "event_peak", "observed_value": 0.8, "confidence": 0.73, "evidence_refs": ["service_model"] },
    { "candidate_id": "central_cooling_centers", "scenario_id": "transit_disruption", "invariant_id": "high_risk_health_index", "stakeholder_id": "high_risk_residents", "scale": "municipal", "time_point": "hour_24", "observed_value": 0.8, "confidence": 0.77, "evidence_refs": ["heat_model"] },
    { "candidate_id": "central_cooling_centers", "scenario_id": "transit_disruption", "invariant_id": "cooling_access_fraction", "stakeholder_id": "residents", "scale": "municipal", "time_point": "hour_24", "observed_value": 0.81, "confidence": 0.72, "evidence_refs": ["service_model"] },

    { "candidate_id": "distributed_passive_network", "scenario_id": "ordinary_heatwave", "invariant_id": "high_risk_health_index", "stakeholder_id": "high_risk_residents", "scale": "municipal", "time_point": "event_peak", "observed_value": 0.65, "confidence": 0.82, "evidence_refs": ["heat_model"] },
    { "candidate_id": "distributed_passive_network", "scenario_id": "ordinary_heatwave", "invariant_id": "cooling_access_fraction", "stakeholder_id": "residents", "scale": "municipal", "time_point": "event_peak", "observed_value": 0.9, "confidence": 0.78, "evidence_refs": ["service_model"] },
    { "candidate_id": "distributed_passive_network", "scenario_id": "grid_outage_heatwave", "invariant_id": "high_risk_health_index", "stakeholder_id": "high_risk_residents", "scale": "municipal", "time_point": "hour_48", "observed_value": 0.9, "confidence": 0.78, "evidence_refs": ["heat_model"] },
    { "candidate_id": "distributed_passive_network", "scenario_id": "grid_outage_heatwave", "invariant_id": "cooling_access_fraction", "stakeholder_id": "residents", "scale": "municipal", "time_point": "hour_48", "observed_value": 0.86, "confidence": 0.75, "evidence_refs": ["service_model"] },
    { "candidate_id": "distributed_passive_network", "scenario_id": "smoke_heat_compound", "invariant_id": "high_risk_health_index", "stakeholder_id": "high_risk_residents", "scale": "municipal", "time_point": "event_peak", "observed_value": 0.82, "confidence": 0.75, "evidence_refs": ["heat_model"] },
    { "candidate_id": "distributed_passive_network", "scenario_id": "smoke_heat_compound", "invariant_id": "cooling_access_fraction", "stakeholder_id": "residents", "scale": "municipal", "time_point": "event_peak", "observed_value": 0.84, "observed_interval": { "lower": 0.82, "upper": 0.86, "basis": "Synthetic service-access range" }, "confidence": 0.74, "evidence_refs": ["service_model"] },
    { "candidate_id": "distributed_passive_network", "scenario_id": "transit_disruption", "invariant_id": "high_risk_health_index", "stakeholder_id": "high_risk_residents", "scale": "municipal", "time_point": "hour_24", "observed_value": 0.7, "confidence": 0.77, "evidence_refs": ["heat_model"] },
    { "candidate_id": "distributed_passive_network", "scenario_id": "transit_disruption", "invariant_id": "cooling_access_fraction", "stakeholder_id": "residents", "scale": "municipal", "time_point": "hour_24", "observed_value": 0.88, "confidence": 0.75, "evidence_refs": ["service_model"] },

    { "candidate_id": "alert_only", "scenario_id": "ordinary_heatwave", "invariant_id": "high_risk_health_index", "stakeholder_id": "high_risk_residents", "scale": "municipal", "time_point": "event_peak", "observed_value": 0.9, "confidence": 0.82, "evidence_refs": ["heat_model"] },
    { "candidate_id": "alert_only", "scenario_id": "ordinary_heatwave", "invariant_id": "cooling_access_fraction", "stakeholder_id": "residents", "scale": "municipal", "time_point": "event_peak", "observed_value": 0.82, "confidence": 0.78, "evidence_refs": ["service_model"] },
    { "candidate_id": "alert_only", "scenario_id": "grid_outage_heatwave", "invariant_id": "high_risk_health_index", "stakeholder_id": "high_risk_residents", "scale": "municipal", "time_point": "hour_48", "observed_value": 1.4, "confidence": 0.78, "evidence_refs": ["heat_model"] },
    { "candidate_id": "alert_only", "scenario_id": "grid_outage_heatwave", "invariant_id": "cooling_access_fraction", "stakeholder_id": "residents", "scale": "municipal", "time_point": "hour_48", "observed_value": 0.5, "confidence": 0.74, "evidence_refs": ["service_model"] },
    { "candidate_id": "alert_only", "scenario_id": "smoke_heat_compound", "invariant_id": "high_risk_health_index", "stakeholder_id": "high_risk_residents", "scale": "municipal", "time_point": "event_peak", "observed_value": 1.8, "confidence": 0.75, "evidence_refs": ["heat_model"] },
    { "candidate_id": "alert_only", "scenario_id": "smoke_heat_compound", "invariant_id": "cooling_access_fraction", "stakeholder_id": "residents", "scale": "municipal", "time_point": "event_peak", "observed_value": 0.4, "confidence": 0.73, "evidence_refs": ["service_model"] },
    { "candidate_id": "alert_only", "scenario_id": "transit_disruption", "invariant_id": "high_risk_health_index", "stakeholder_id": "high_risk_residents", "scale": "municipal", "time_point": "hour_24", "observed_value": 1.2, "confidence": 0.77, "evidence_refs": ["heat_model"] },
    { "candidate_id": "alert_only", "scenario_id": "transit_disruption", "invariant_id": "cooling_access_fraction", "stakeholder_id": "residents", "scale": "municipal", "time_point": "hour_24", "observed_value": 0.65, "confidence": 0.72, "evidence_refs": ["service_model"] }
  ],
  "trajectories": [
    {
      "candidate_id": "central_cooling_centers",
      "scenario_id": "smoke_heat_compound",
      "invariant_id": "high_risk_health_index",
      "stakeholder_id": "high_risk_residents",
      "scale": "municipal",
      "basis": "Synthetic ten-day compound-event trajectory",
      "samples": [
        { "elapsed_hours": 0, "observed_value": 0.7, "evidence_refs": ["heat_model"] },
        { "elapsed_hours": 72, "observed_value": 0.95, "observed_interval": { "lower": 0.9, "upper": 0.98, "basis": "Synthetic heat-health envelope" }, "evidence_refs": ["heat_model"] },
        { "elapsed_hours": 240, "observed_value": 0.8, "evidence_refs": ["heat_model"] }
      ]
    },
    {
      "candidate_id": "central_cooling_centers",
      "scenario_id": "smoke_heat_compound",
      "invariant_id": "cooling_access_fraction",
      "stakeholder_id": "residents",
      "scale": "municipal",
      "basis": "Synthetic ten-day compound-event trajectory",
      "samples": [
        { "elapsed_hours": 0, "observed_value": 0.95, "evidence_refs": ["service_model"] },
        { "elapsed_hours": 72, "observed_value": 0.82, "observed_interval": { "lower": 0.8, "upper": 0.84, "basis": "Synthetic service envelope" }, "evidence_refs": ["service_model"] },
        { "elapsed_hours": 240, "observed_value": 0.9, "evidence_refs": ["service_model"] }
      ]
    },
    {
      "candidate_id": "distributed_passive_network",